{
  "id": "second-term",
  "title": "Second Term Controversies (2025-Present)",
  "slug": "second-term",
  "description": "# Second Term Controversies (2025-Present)\n\nTrump's second term has been marked by systematic corruption, abuse of the pardon power, weaponization of the justice system against political opponents, deadly immigration enforcement operations, reckless military actions, and basic governance failures—revealing a pattern of authoritarian behavior and disregard for democratic norms.\n\n## Major Categories\n\n### Corruption & Financial Conflicts\n\n- **$TRUMP Meme Coin:** Launched 3 days before inauguration, family made $320+ million\n- **Qatar $400M Plane Gift:** Largest foreign bribe to a president in American history\n- **Tariff Chaos & Corruption:** Granting exemptions to wealthy donors and politically connected businesses\n- **Golf Spending:** $71 million spent on golf in 2025\n\n### Pardons & Justice System Weaponization\n\n- **Mass Pardons for January 6 Defendants:** ~1,500 people granted blanket clemency\n- **Drug Kingpin Pardons:** Ross Ulbricht, Larry Hoover, Juan Orlando Hernández\n- **Fake Electors Pardons:** 77 people involved in 2020 fake electors scheme pardoned\n- **DOJ Weaponization:** Installing loyalists, targeting political opponents with investigations\n\n### Immigration & Border Enforcement Abuses\n\n- **ICE Enforcement:** At least 16 shooting incidents, 4 deaths since January 2025\n- **Fatal Shooting of Renee Good:** Character assassination without investigation\n- **Wrongful Detentions:** U.S. citizens detained and deported\n- **Immigration Judges Purge:** Nearly 100 judges fired and replaced with loyalists\n\n### Military & Foreign Policy\n\n- **\"Signalgate\" / War Plans Leak:** Defense Secretary shared classified military plans via Signal\n- **Caribbean Drug Boat Strikes:** 22+ strikes killed at least 87 people, UK stopped sharing intelligence\n- **Venezuela Military Operation:** Captured Maduro, Trump said \"We're going to run the country\"\n- **Nobel Peace Prize Controversy:** Machado offered to \"share\" prize with Trump\n\n### Governance Failures\n\n- **White House Website Rewrites January 6 History:** Official government historical revisionism\n- **43-Day Government Shutdown:** Longest in US history, 670,000 workers furloughed\n- **Fired Inspectors General:** Removed 17+ watchdogs on first day\n\n---\n\n**Note:** Due to the extensive and detailed nature of the second term controversies (over 350 individual documented incidents), please refer to the [comprehensive README on GitHub](https://github.com/politiboop/controversial-trump/blob/main/README.md) for complete details with full sources and citations. This page provides a high-level overview of the major categories.",
  "summary": "Trump's second term has been marked by systematic corruption, abuse of the pardon power, weaponization of the justice system against political opponents, deadly immigration enforcement operations, reckless military actions, and basic governance failures—revealing a pattern of authoritarian behavior and disregard for democratic norms.",
  "date": "2020-01-01",
  "tags": {
    "timeline": [
      "first-term",
      "second-term"
    ],
    "type": [
      "financial",
      "policy",
      "personal",
      "political"
    ],
    "topic": [
      "democracy",
      "corruption",
      "foreign-policy",
      "immigration",
      "military",
      "justice-system",
      "economy"
    ],
    "severity": "verified"
  },
  "keyPoints": [
    "**$TRUMP Meme Coin:** Launched 3 days before inauguration, family made $320+ million",
    "**Qatar $400M Plane Gift:** Largest foreign bribe to a president in American history",
    "**Tariff Chaos & Corruption:** Granting exemptions to wealthy donors and politically connected businesses",
    "**Golf Spending:** $71 million spent on golf in 2025",
    "**Mass Pardons for January 6 Defendants:** ~1,500 people granted blanket clemency",
    "**Drug Kingpin Pardons:** Ross Ulbricht, Larry Hoover, Juan Orlando Hernández",
    "**Fake Electors Pardons:** 77 people involved in 2020 fake electors scheme pardoned",
    "**DOJ Weaponization:** Installing loyalists, targeting political opponents with investigations",
    "**ICE Enforcement:** At least 16 shooting incidents, 4 deaths since January 2025",
    "**Fatal Shooting of Renee Good:** Character assassination without investigation",
    "**Wrongful Detentions:** U.S. citizens detained and deported",
    "**Immigration Judges Purge:** Nearly 100 judges fired and replaced with loyalists",
    "**\"Signalgate\" / War Plans Leak:** Defense Secretary shared classified military plans via Signal",
    "**Caribbean Drug Boat Strikes:** 22+ strikes killed at least 87 people, UK stopped sharing intelligence",
    "**Venezuela Military Operation:** Captured Maduro, Trump said \"We're going to run the country\"",
    "**Nobel Peace Prize Controversy:** Machado offered to \"share\" prize with Trump",
    "**White House Website Rewrites January 6 History:** Official government historical revisionism",
    "**43-Day Government Shutdown:** Longest in US history, 670,000 workers furloughed",
    "**Fired Inspectors General:** Removed 17+ watchdogs on first day"
  ],
  "sources": [
    {
      "text": "Comprehensive documentation on GitHub",
      "type": "news"
    },
    {
      "text": "Multiple news sources 2025-2026",
      "type": "news"
    }
  ],
  "metadata": {
    "featured": false,
    "priority": 5,
    "lastUpdated": "2026-01-20T21:00:50.616Z",
    "status": "active"
  }
}