{
  "id": "prominent-republicans-warned",
  "title": "Prominent Republicans Who Warned Against Trump",
  "slug": "prominent-republicans-warned",
  "description": "# Prominent Republicans Who Warned Against Trump\n\nBeyond his own administration, numerous high-profile Republicans, senators, governors, and conservative leaders publicly warned Americans not to re-elect Trump:\n\n## Mitt Romney - Senator & 2012 GOP Presidential Nominee\n\n- **\"I believe that Donald Trump was not successful as president and that his character and his conduct make him unfit to be president again\"** [Source: CNN interview, 2023]\n- Called Trump **\"manifestly unfit for office\"** after January 6 [Source: Senate floor speech, 2021]\n- Only Republican senator to vote to convict Trump in **both impeachment trials**\n- **\"The president's conduct... was a flagrant assault on our electoral process and on our constitutional process\"** [Source: Senate speech]\n\n## Liz Cheney - Former House GOP Conference Chair\n\n- **\"Donald Trump is unfit for any office\"** [Source: ABC News interview, 2022]\n- **\"He can never be trusted with power again\"** after January 6 investigation\n- Lost GOP primary for opposing Trump; called it **\"the beginning of taking our party back\"**\n- Endorsed Kamala Harris: **\"I know Donald Trump. I know how dangerous he is\"** [Source: 2024 campaign event]\n- **\"No conservative can support Donald Trump\"** [Source: Multiple interviews]\n\n## Adam Kinzinger - Former House GOP Member\n\n- **\"Donald Trump should not be president again. He's shown he can't handle power\"** [Source: CNN, 2022]\n- Founded **\"Country First\"** movement to oppose Trump\n- Endorsed Joe Biden: **\"Donald Trump is a threat to democracy\"**\n- Called Trump **\"morally bankrupt\"** and **\"fundamentally broken\"**\n- **\"I'd rather lose an election than lose my soul\"** [Source: Book \"Renegade\"]\n\n## Chris Christie - Former Governor & 2024 Presidential Candidate\n\n- **\"Donald Trump is unfit to be president of the United States\"** [Source: 2024 GOP primary debates]\n- Called Trump **\"a child\"** who **\"only cares about himself\"**\n- **\"Someone who I trusted with the most powerful office in the world betrayed that trust\"** after January 6\n- Suspended 2024 campaign rather than risk helping Trump win nomination\n\n## Asa Hutchinson - Former Arkansas Governor\n\n- **\"Donald Trump is morally disqualified from being president again\"** [Source: 2023 interviews]\n- Called on Trump to **\"step aside\"** after January 6\n- **\"We cannot have a president who puts himself above the Constitution\"**\n\n## Larry Hogan - Former Maryland Governor\n\n- **\"We need to move on from Donald Trump\"** [Source: Multiple interviews, 2022-2024]\n- **\"He's a loser who has cost us election after election\"**\n- Refused to endorse Trump despite being GOP Senate nominee\n\n## Geoff Duncan - Former Georgia Lt. Governor\n\n- **\"Donald Trump is a liability for our party and our country\"** [Source: CNN, 2023]\n- Testified against Trump in Georgia election interference case\n- **\"Country over party\"** - endorsed no candidate rather than support Trump\n\n## John Kasich - Former Ohio Governor & 2016 GOP Candidate\n\n- **\"I cannot and will not support Donald Trump\"** [Source: 2020, 2024 statements]\n- Spoke at 2020 Democratic National Convention against Trump\n- **\"The stakes are too high for our country\"**\n\n## The Lincoln Project & Conservative Leaders\n\n- **Over 200 former Republican officials** signed letters opposing Trump [Source: Republicans for the Rule of Law, 2020, 2024]\n- Conservative lawyers group: **\"Donald Trump is a clear and present danger to American democracy\"**\n- **\"Duty to Country\"** - Group of former Trump officials opposing his return",
  "summary": "Beyond his own administration, numerous high-profile Republicans, senators, governors, and conservative leaders publicly warned Americans not to re-elect Trump:",
  "date": "2020-01-01",
  "tags": {
    "timeline": [
      "campaign-2016",
      "first-term",
      "campaign-2024"
    ],
    "type": [
      "policy",
      "personal",
      "political"
    ],
    "topic": [
      "democracy",
      "women",
      "cabinet"
    ],
    "severity": "verified"
  },
  "keyPoints": [
    "**\"I believe that Donald Trump was not successful as president and that his character and his conduct make him unfit to be president again\"** [Source: CNN interview, 2023]",
    "Called Trump **\"manifestly unfit for office\"** after January 6 [Source: Senate floor speech, 2021]",
    "Only Republican senator to vote to convict Trump in **both impeachment trials**",
    "**\"The president's conduct... was a flagrant assault on our electoral process and on our constitutional process\"** [Source: Senate speech]",
    "**\"Donald Trump is unfit for any office\"** [Source: ABC News interview, 2022]",
    "**\"He can never be trusted with power again\"** after January 6 investigation",
    "Lost GOP primary for opposing Trump; called it **\"the beginning of taking our party back\"**",
    "Endorsed Kamala Harris: **\"I know Donald Trump. I know how dangerous he is\"** [Source: 2024 campaign event]",
    "**\"No conservative can support Donald Trump\"** [Source: Multiple interviews]",
    "**\"Donald Trump should not be president again. He's shown he can't handle power\"** [Source: CNN, 2022]",
    "Founded **\"Country First\"** movement to oppose Trump",
    "Endorsed Joe Biden: **\"Donald Trump is a threat to democracy\"**",
    "Called Trump **\"morally bankrupt\"** and **\"fundamentally broken\"**",
    "**\"I'd rather lose an election than lose my soul\"** [Source: Book \"Renegade\"]",
    "**\"Donald Trump is unfit to be president of the United States\"** [Source: 2024 GOP primary debates]",
    "Called Trump **\"a child\"** who **\"only cares about himself\"**",
    "**\"Someone who I trusted with the most powerful office in the world betrayed that trust\"** after January 6",
    "Suspended 2024 campaign rather than risk helping Trump win nomination",
    "**\"Donald Trump is morally disqualified from being president again\"** [Source: 2023 interviews]",
    "Called on Trump to **\"step aside\"** after January 6",
    "**\"We cannot have a president who puts himself above the Constitution\"**",
    "**\"We need to move on from Donald Trump\"** [Source: Multiple interviews, 2022-2024]",
    "**\"He's a loser who has cost us election after election\"**",
    "Refused to endorse Trump despite being GOP Senate nominee",
    "**\"Donald Trump is a liability for our party and our country\"** [Source: CNN, 2023]",
    "Testified against Trump in Georgia election interference case",
    "**\"Country over party\"** - endorsed no candidate rather than support Trump",
    "**\"I cannot and will not support Donald Trump\"** [Source: 2020, 2024 statements]",
    "Spoke at 2020 Democratic National Convention against Trump",
    "**\"The stakes are too high for our country\"**",
    "**Over 200 former Republican officials** signed letters opposing Trump [Source: Republicans for the Rule of Law, 2020, 2024]",
    "Conservative lawyers group: **\"Donald Trump is a clear and present danger to American democracy\"**",
    "**\"Duty to Country\"** - Group of former Trump officials opposing his return"
  ],
  "sources": [
    {
      "text": "CNN interview, 2023",
      "type": "news"
    },
    {
      "text": "Senate floor speech, 2021",
      "type": "news"
    },
    {
      "text": "Senate speech",
      "type": "news"
    },
    {
      "text": "ABC News interview, 2022",
      "type": "news"
    },
    {
      "text": "2024 campaign event",
      "type": "news"
    },
    {
      "text": "Multiple interviews",
      "type": "news"
    },
    {
      "text": "CNN, 2022",
      "type": "news"
    },
    {
      "text": "Book \"Renegade\"",
      "type": "book"
    },
    {
      "text": "2024 GOP primary debates",
      "type": "news"
    },
    {
      "text": "2023 interviews",
      "type": "news"
    },
    {
      "text": "Multiple interviews, 2022-2024",
      "type": "news"
    },
    {
      "text": "CNN, 2023",
      "type": "news"
    },
    {
      "text": "2020, 2024 statements",
      "type": "government"
    },
    {
      "text": "Republicans for the Rule of Law, 2020, 2024",
      "type": "news"
    }
  ],
  "metadata": {
    "featured": false,
    "priority": 5,
    "lastUpdated": "2026-01-20T21:00:40.051Z",
    "status": "active"
  }
}