{
  "id": "haitians-eating-pets",
  "title": "Haitians Eating Pets in Springfield",
  "slug": "haitians-eating-pets",
  "description": "# Haitians Eating Pets in Springfield, Ohio (2024)\n\n- **September 2024 debate:** Trump claimed Haitian immigrants in Springfield, Ohio were **\"eating the dogs\"** and **\"eating the cats\"** [Source: Presidential debate, September 10, 2024]\n- **\"They're eating the pets of the people that live there\"** [Source: Debate transcript]\n- City officials, police, and local residents confirmed this was **completely false** [Source: Springfield city manager, police statements]\n- JD Vance admitted he **\"created\"** the story to draw attention to immigration [Source: CNN interview, September 2024]\n- **PolitiFact named it the 2024 \"Lie of the Year\"** - Trump's **fourth** such award [Source: PolitiFact, December 2024]\n- Led to bomb threats against Springfield schools and hospitals [Source: News reports, September 2024]\n- Trump never retracted the claim and repeated it at rallies",
  "summary": "- September 2024 debate: Trump claimed Haitian immigrants in Springfield, Ohio were \"eating the dogs\" and \"eating the cats\" \n- \"They're eating the pets of the people that live there\" \n- City officials, police, and local residents confirmed this was completely false \n- JD Vance admitted he \"created\" the story to draw attention to immigration \n- PolitiFact named it the 2024 \"Lie of the Year\" - Tr...",
  "date": "2024-09-10",
  "tags": {
    "timeline": [
      "campaign-2024"
    ],
    "type": [
      "political"
    ],
    "topic": [
      "immigration"
    ],
    "severity": "disputed"
  },
  "keyPoints": [
    "**September 2024 debate:** Trump claimed Haitian immigrants in Springfield, Ohio were **\"eating the dogs\"** and **\"eating the cats\"** [Source: Presidential debate, September 10, 2024]",
    "**\"They're eating the pets of the people that live there\"** [Source: Debate transcript]",
    "City officials, police, and local residents confirmed this was **completely false** [Source: Springfield city manager, police statements]",
    "JD Vance admitted he **\"created\"** the story to draw attention to immigration [Source: CNN interview, September 2024]",
    "**PolitiFact named it the 2024 \"Lie of the Year\"** - Trump's **fourth** such award [Source: PolitiFact, December 2024]",
    "Led to bomb threats against Springfield schools and hospitals [Source: News reports, September 2024]",
    "Trump never retracted the claim and repeated it at rallies"
  ],
  "sources": [
    {
      "text": "Presidential debate, September 10, 2024",
      "type": "news"
    },
    {
      "text": "Debate transcript",
      "type": "news"
    },
    {
      "text": "Springfield city manager, police statements",
      "type": "government"
    },
    {
      "text": "CNN interview, September 2024",
      "type": "news"
    },
    {
      "text": "PolitiFact, December 2024",
      "type": "news"
    },
    {
      "text": "News reports, September 2024",
      "type": "news"
    }
  ],
  "metadata": {
    "featured": false,
    "priority": 5,
    "lastUpdated": "2026-01-20T21:00:00.604Z",
    "status": "active"
  }
}