{
  "id": "disinfectant",
  "title": "Injecting Disinfectant & UV Light",
  "slug": "disinfectant",
  "description": "# Injecting Disinfectant & UV Light Inside the Body\n\n- **April 23, 2020 press conference:** Suggested researching injection of disinfectant as COVID treatment\n- **Exact quote:** \"And then I see the disinfectant, where it knocks it out in a minute, one minute. And is there a way we can do something like that by injection inside or almost a cleaning?\" [Source: White House briefing video transcript, April 23, 2020]\n- Also suggested bringing UV light **\"inside the body\"** somehow\n- Lysol, Clorox, and poison control centers issued **emergency warnings** not to ingest disinfectants [Source: Emergency statements, April 2020]\n- Next day claimed he was **\"being sarcastic\"** - video clearly shows he was addressing medical experts seriously [Source: CNN fact-check, April 24, 2020]\n- Disinfectant poisoning calls spiked dramatically after the briefing [Source: CDC poison control data]",
  "summary": "- April 23, 2020 press conference: Suggested researching injection of disinfectant as COVID treatment\n- Exact quote: \"And then I see the disinfectant, where it knocks it out in a minute, one minute. And is there a way we can do something like that by injection inside or almost a cleaning?\" \n- Also suggested bringing UV light \"inside the body\" somehow\n- Lysol, Clorox, and poison control centers ...",
  "date": "2020-04-23",
  "tags": {
    "timeline": [
      "first-term"
    ],
    "type": [
      "political"
    ],
    "topic": [
      "covid"
    ],
    "severity": "verified"
  },
  "keyPoints": [
    "**April 23, 2020 press conference:** Suggested researching injection of disinfectant as COVID treatment",
    "**Exact quote:** \"And then I see the disinfectant, where it knocks it out in a minute, one minute. And is there a way we can do something like that by injection inside or almost a cleaning?\" [Source: White House briefing video transcript, April 23, 2020]",
    "Also suggested bringing UV light **\"inside the body\"** somehow",
    "Lysol, Clorox, and poison control centers issued **emergency warnings** not to ingest disinfectants [Source: Emergency statements, April 2020]",
    "Next day claimed he was **\"being sarcastic\"** - video clearly shows he was addressing medical experts seriously [Source: CNN fact-check, April 24, 2020]",
    "Disinfectant poisoning calls spiked dramatically after the briefing [Source: CDC poison control data]"
  ],
  "sources": [
    {
      "text": "White House briefing video transcript, April 23, 2020",
      "type": "government"
    },
    {
      "text": "Emergency statements, April 2020",
      "type": "government"
    },
    {
      "text": "CNN fact-check, April 24, 2020",
      "type": "news"
    },
    {
      "text": "CDC poison control data",
      "type": "news"
    }
  ],
  "metadata": {
    "featured": false,
    "priority": 5,
    "lastUpdated": "2026-01-20T21:00:00.590Z",
    "status": "active"
  }
}