{
  "id": "trump-epstein",
  "title": "Trump-Epstein Relationship & Files Controversy",
  "slug": "trump-epstein",
  "description": "# Trump-Epstein Relationship & Files Controversy\n\n## Long History with Jeffrey Epstein\n\n- **Decades-long friendship:** Partied together in NYC and Palm Beach throughout 1990s-2000s\n- **2002 Trump quote to NY Magazine:** \"I've known Jeff for fifteen years. Terrific guy. He's a lot of fun to be with. It is even said that he likes beautiful women as much as I do, and many of them are on the younger side\"\n- Flight logs show Trump flew on Epstein's plane **at least 7 times** between 1993-1997\n- Epstein was member of Mar-a-Lago until banned (Trump claims 2007; others say later)\n- **2010 Epstein deposition:** Pleaded the Fifth when asked about socializing with Trump\n\n## Lies and Contradictions About Relationship\n\n- **July 2019:** \"I was not a fan of his, that I can tell you\"—contradicts his own 2002 praise\n- Claimed he banned Epstein from Mar-a-Lago **\"immediately\"** after learning of crimes—timeline disputed\n- **\"I had a falling out with him a long time ago\"**—but was photographed with him at parties through 2000s\n- Denied knowing about Epstein's crimes despite 2002 comment about liking women \"on the younger side\"\n- Claimed \"I haven't spoken to him in 15 years\"—but phone records show calls between them\n\n## The Epstein Files Revelations (2025)\n\n- **January 2025:** Trump administration initially fought release of remaining DOJ Epstein files\n- Federal judge ordered release over administration objections\n- **Epstein's emails released:** Showed Epstein wrote Trump **\"knew about the girls\"** and **\"spent hours at my house\"** with young woman identified as victim\n- Another email: Epstein claimed Trump was **\"interested in [victim's name redacted] but she was too old for him\"**\n- **Trump's own Attorney General (Bondi)** confirmed authenticity of emails to Congress\n- Multiple cabinet members privately acknowledged Trump appears throughout the files\n\n## Alexander Acosta - The Epstein Deal Connection\n\n- Trump appointed **Alexander Acosta** as Labor Secretary (2017-2019)\n- Acosta was the prosecutor who gave Epstein controversial **sweetheart plea deal** in 2008\n- Deal gave Epstein only 13 months (served in private wing, allowed to leave 6 days/week for \"work\")\n- Granted immunity to **\"any potential co-conspirators\"**—unprecedented for federal case\n- Acosta resigned in 2019 after Epstein re-arrest brought renewed scrutiny\n- When asked why he appointed Acosta, Trump: **\"I don't know much about it\"**\n\n## Response to Files & Public Reaction\n\n- Trump called files **\"fake\"** and **\"fabricated\"** despite his own DOJ confirming authenticity\n- Attacked judges who ordered release as **\"radical left activists\"**\n- **Elon Musk tweet (deleted after 10 minutes):** \"The files speak for themselves\"\n- **65% of voters** disapproved of administration's handling (Reuters poll)\n- Multiple GOP senators called for **\"full transparency\"** on the files\n- Trump never addressed specific allegations, only attacked process",
  "summary": "- Decades-long friendship: Partied together in NYC and Palm Beach throughout 1990s-2000s\n- 2002 Trump quote to NY Magazine: \"I've known Jeff for fifteen years. Terrific guy. He's a lot of fun to be with. It is even said that he likes beautiful women as much as I do, and many of them are on the younger side\"\n- Flight logs show Trump flew on Epstein's plane at least 7 times between 1993-1997\n- Ep...",
  "date": "2020-01-01",
  "tags": {
    "timeline": [
      "first-term",
      "second-term"
    ],
    "type": [
      "legal",
      "personal"
    ],
    "topic": [
      "women",
      "cabinet",
      "justice-system"
    ],
    "severity": "disputed"
  },
  "keyPoints": [
    "**Decades-long friendship:** Partied together in NYC and Palm Beach throughout 1990s-2000s",
    "**2002 Trump quote to NY Magazine:** \"I've known Jeff for fifteen years. Terrific guy. He's a lot of fun to be with. It is even said that he likes beautiful women as much as I do, and many of them are on the younger side\"",
    "Flight logs show Trump flew on Epstein's plane **at least 7 times** between 1993-1997",
    "Epstein was member of Mar-a-Lago until banned (Trump claims 2007; others say later)",
    "**2010 Epstein deposition:** Pleaded the Fifth when asked about socializing with Trump",
    "**July 2019:** \"I was not a fan of his, that I can tell you\"—contradicts his own 2002 praise",
    "Claimed he banned Epstein from Mar-a-Lago **\"immediately\"** after learning of crimes—timeline disputed",
    "**\"I had a falling out with him a long time ago\"**—but was photographed with him at parties through 2000s",
    "Denied knowing about Epstein's crimes despite 2002 comment about liking women \"on the younger side\"",
    "Claimed \"I haven't spoken to him in 15 years\"—but phone records show calls between them",
    "**January 2025:** Trump administration initially fought release of remaining DOJ Epstein files",
    "Federal judge ordered release over administration objections",
    "**Epstein's emails released:** Showed Epstein wrote Trump **\"knew about the girls\"** and **\"spent hours at my house\"** with young woman identified as victim",
    "Another email: Epstein claimed Trump was **\"interested in [victim's name redacted] but she was too old for him\"**",
    "**Trump's own Attorney General (Bondi)** confirmed authenticity of emails to Congress",
    "Multiple cabinet members privately acknowledged Trump appears throughout the files",
    "Trump appointed **Alexander Acosta** as Labor Secretary (2017-2019)",
    "Acosta was the prosecutor who gave Epstein controversial **sweetheart plea deal** in 2008",
    "Deal gave Epstein only 13 months (served in private wing, allowed to leave 6 days/week for \"work\")",
    "Granted immunity to **\"any potential co-conspirators\"**—unprecedented for federal case",
    "Acosta resigned in 2019 after Epstein re-arrest brought renewed scrutiny",
    "When asked why he appointed Acosta, Trump: **\"I don't know much about it\"**",
    "Trump called files **\"fake\"** and **\"fabricated\"** despite his own DOJ confirming authenticity",
    "Attacked judges who ordered release as **\"radical left activists\"**",
    "**Elon Musk tweet (deleted after 10 minutes):** \"The files speak for themselves\"",
    "**65% of voters** disapproved of administration's handling (Reuters poll)",
    "Multiple GOP senators called for **\"full transparency\"** on the files",
    "Trump never addressed specific allegations, only attacked process"
  ],
  "sources": [
    {
      "text": "NY Magazine interview, 2002",
      "type": "news",
      "date": "2002-01-01"
    },
    {
      "text": "Epstein flight logs",
      "type": "court"
    },
    {
      "text": "Epstein deposition, 2010",
      "type": "court",
      "date": "2010-01-01"
    },
    {
      "text": "DOJ Epstein files release, January 2025",
      "type": "government",
      "date": "2025-01-01"
    },
    {
      "text": "Reuters poll on handling of files",
      "type": "news"
    }
  ],
  "metadata": {
    "featured": false,
    "priority": 5,
    "lastUpdated": "2026-01-20T21:00:29.847Z",
    "status": "active"
  }
}