{
  "id": "nuking-hurricanes",
  "title": "Nuking Hurricanes",
  "slug": "nuking-hurricanes",
  "description": "# Nuking Hurricanes\n\n- **Multiple occasions (2017-2019):** Trump repeatedly suggested dropping nuclear bombs into hurricanes to disrupt them before they make landfall [Source: Axios, August 2019; confirmed by multiple officials]\n- Reportedly asked senior Homeland Security and national security officials: **\"Why don't we nuke them?\"**\n- NOAA had to publish explainer on why this would be catastrophic [Source: NOAA.gov]\n- Would spread radioactive fallout, not actually stop the hurricane\n- Officials said the briefing was interrupted by Trump asking about nukes so often they had to address it",
  "summary": "- Multiple occasions (2017-2019): Trump repeatedly suggested dropping nuclear bombs into hurricanes to disrupt them before they make landfall \n- Reportedly asked senior Homeland Security and national security officials: \"Why don't we nuke them?\"\n- NOAA had to publish explainer on why this would be catastrophic \n- Would spread radioactive fallout, not actually stop the hurricane\n- Officials said...",
  "date": "2020-01-01",
  "tags": {
    "timeline": [
      "first-term"
    ],
    "type": [
      "political"
    ],
    "topic": [
      "character"
    ],
    "severity": "verified"
  },
  "keyPoints": [
    "**Multiple occasions (2017-2019):** Trump repeatedly suggested dropping nuclear bombs into hurricanes to disrupt them before they make landfall [Source: Axios, August 2019; confirmed by multiple officials]",
    "Reportedly asked senior Homeland Security and national security officials: **\"Why don't we nuke them?\"**",
    "NOAA had to publish explainer on why this would be catastrophic [Source: NOAA.gov]",
    "Would spread radioactive fallout, not actually stop the hurricane",
    "Officials said the briefing was interrupted by Trump asking about nukes so often they had to address it"
  ],
  "sources": [
    {
      "text": "Axios, August 2019; confirmed by multiple officials",
      "type": "government"
    },
    {
      "text": "NOAA.gov",
      "type": "news"
    }
  ],
  "metadata": {
    "featured": false,
    "priority": 5,
    "lastUpdated": "2026-01-20T21:00:00.616Z",
    "status": "active"
  }
}