{
  "id": "schedule-f",
  "title": "Schedule F and the Plan to Purge Civil Service",
  "slug": "schedule-f",
  "description": "# Schedule F and the Plan to Purge Civil Service\n\n**ðŸ”¶ Policy Disagreement:** Supporters view this as legitimate civil service reform to make bureaucracy more accountable. Critics view it as enabling a purge of career professionals who aren't personally loyal to the president.\n\n## Trump's Executive Order and Stated Plans\n\n- **October 2020:** Signed Executive Order 13957 creating \"Schedule F\" classification [Source: Federal Register, October 21, 2020]\n- Would have stripped job protections from **tens of thousands** of federal employees [Source: OPM analysis, Brookings Institution]\n- Allowed firing career civil servants and replacing with political appointees [Source: Executive order text, legal analysis]\n- Biden immediately revoked upon taking office (January 2021) [Source: Executive Order 14003, January 22, 2021]\n- **Trump vowed to reinstate \"immediately\" if re-elected** [Source: Campaign statements, 2023-2024; Agenda47 video]\n- Heritage Foundation's Project 2025 called for firing **50,000+ civil servants** [Source: Project 2025 document, pages 80-82]\n\n## Critics' Concerns\n\n- Would gut institutional knowledge and expertise across government [Source: Government accountability experts, NPR analysis]\n- **Opinion:** Former officials called it **\"the biggest threat to democracy\"** in Trump's plans [Source: Former OPM officials quoted in Washington Post]\n- Would enable removal of anyone not personally loyal to Trump [Source: Legal experts, Brookings analysis]\n\n## Supporters' Argument\n\n- Career bureaucrats (\"deep state\") resist elected officials' policy agendas\n- President should have ability to implement the policies voters chose\n- Current civil service protections shield underperformance and obstruction",
  "summary": "ðŸ”¶ Policy Disagreement: Supporters view this as legitimate civil service reform to make bureaucracy more accountable. Critics view it as enabling a purge of career professionals who aren't personally loyal to the president.",
  "date": "2020-10-21",
  "tags": {
    "timeline": [
      "first-term",
      "campaign-2024",
      "second-term"
    ],
    "type": [
      "policy",
      "political"
    ],
    "topic": [
      "democracy"
    ],
    "severity": "opinion"
  },
  "keyPoints": [
    "**October 2020:** Signed Executive Order 13957 creating \"Schedule F\" classification [Source: Federal Register, October 21, 2020]",
    "Would have stripped job protections from **tens of thousands** of federal employees [Source: OPM analysis, Brookings Institution]",
    "Allowed firing career civil servants and replacing with political appointees [Source: Executive order text, legal analysis]",
    "Biden immediately revoked upon taking office (January 2021) [Source: Executive Order 14003, January 22, 2021]",
    "**Trump vowed to reinstate \"immediately\" if re-elected** [Source: Campaign statements, 2023-2024; Agenda47 video]",
    "Heritage Foundation's Project 2025 called for firing **50,000+ civil servants** [Source: Project 2025 document, pages 80-82]",
    "Would gut institutional knowledge and expertise across government [Source: Government accountability experts, NPR analysis]",
    "**Opinion:** Former officials called it **\"the biggest threat to democracy\"** in Trump's plans [Source: Former OPM officials quoted in Washington Post]",
    "Would enable removal of anyone not personally loyal to Trump [Source: Legal experts, Brookings analysis]",
    "Career bureaucrats (\"deep state\") resist elected officials' policy agendas",
    "President should have ability to implement the policies voters chose",
    "Current civil service protections shield underperformance and obstruction"
  ],
  "sources": [
    {
      "text": "Federal Register, October 21, 2020",
      "type": "news"
    },
    {
      "text": "OPM analysis, Brookings Institution",
      "type": "news"
    },
    {
      "text": "Executive order text, legal analysis",
      "type": "news"
    },
    {
      "text": "Executive Order 14003, January 22, 2021",
      "type": "news"
    },
    {
      "text": "Campaign statements, 2023-2024; Agenda47 video",
      "type": "government"
    },
    {
      "text": "Project 2025 document, pages 80-82",
      "type": "news"
    },
    {
      "text": "Government accountability experts, NPR analysis",
      "type": "news"
    },
    {
      "text": "Former OPM officials quoted in Washington Post",
      "type": "government"
    },
    {
      "text": "Legal experts, Brookings analysis",
      "type": "news"
    }
  ],
  "metadata": {
    "featured": false,
    "priority": 5,
    "lastUpdated": "2026-01-20T21:00:13.516Z",
    "status": "active"
  }
}